title,subtitle,author,content,link,category
"Syrian rebels enter third city Homs, says war monitor",The loss of Homs would be another major blow to the forces of President Bahar al-Assad; Hundreds of detainees had escaped from the city's central prison,Miscellaneous,"Syrian rebels enter third city Homs, says war monitor The loss of Homs would be another major blow to the forces of President Bahar al-Assad; Hundreds of detainees had escaped from the city's central prison Islamist-led rebels entered Syria's third city Homs late Saturday (December 7, 2024) taking control of some districts, a war monitor said, drawing a swift denial from the defence ministry. FOLLOW MORE:Syria civil war LIVE updates: Syrian rebels captures Homs central prison; Syrian government forces withdraw",https://www.thehindu.com/news/international/syrian-rebels-enter-third-city-homs-says-war-monitor/article68960114.ece,international
"Assad flees Damascus, say senior Army officers; Syrian rebels take capital","Thousands in cars and on foot congregated at a main square in Damascus waving and chanting ""Freedom""",Miscellaneous,"Assad flees Damascus, say senior Army officers; Syrian rebels take capital Thousands in cars and on foot congregated at a main square in Damascus waving and chanting ""Freedom"" Syrian President Bashar al-Assad boarded a plane and left Damascus for an unknown destination on Sunday (December 8, 2024), two senior army officers told Reuters, as rebels said they had entered the capital with no sign of army deployments. Syria war LIVE updates: Assad regime falls in Syria",https://www.thehindu.com/news/international/assad-flees-damascus-syria-rebels-take-capital/article68961285.ece,international
South Korean prosecutors detain ex-Defence chief over martial law imposition,South Korean prosecutors have detained a former defence minister who allegedly recommended last week’s brief but stunning martial law imposition to President Yoon Suk Yeol,Miscellaneous,"South Korean prosecutors detain ex-Defence chief over martial law imposition South Korean prosecutors have detained a former defence minister who allegedly recommended last week’s brief but stunning martial law imposition to President Yoon Suk Yeol South Korean prosecutors on Sunday (December 8, 2024) detained a former Defence Minister who allegedly recommended last week’s brief but stunning martial law imposition to President Yoon Suk Yeol, making him the first figure detained over the case. Also Read | How will martial law flip-flop affect S. Korea?",https://www.thehindu.com/news/international/south-korean-prosecutors-detain-ex-defense-chief-over-martial-law-imposition/article68961314.ece,international
Syrian PM says ready to cooperate with any leadership chosen by the people,"In a speech broadcast on his Facebook account, Premier Mohammed al-Jalali said “this country can be a normal country that builds good relations with its neighbours and the world”",Miscellaneous,"Syrian PM says ready to cooperate with any leadership chosen by the people In a speech broadcast on his Facebook account, Premier Mohammed al-Jalali said “this country can be a normal country that builds good relations with its neighbours and the world” Syrian Prime Minister Mohammed al-Jalali said Sunday (December 8, 2024) he was ready to ""cooperate"" with any leadership chosen by the people, after rebels said ""tyrant"" President Bashar al-Assad had fled the country. The leader of the Islamist Syrian rebel group Hayat Tahrir al-Sham, Abu Mohammed al-Jolani, ordered forces not to approach official institutions in Damascus, saying they would remain under the Prime Minister until they were ""officially"" handed over.",https://www.thehindu.com/news/international/syrian-pm-says-ready-to-cooperate-with-any-leadership-chosen-by-the-people/article68961273.ece,international
Watch: Assad regime falls in Syria after rebels enter Damascus,Syrian President Bashar al-Assad has fled the country,The Hindu Bureau,Watch: Assad regime falls in Syria after rebels enter Damascus Syrian President Bashar al-Assad has fled the country The Syrian government fell early on December 8 in a stunning end to the 50-year rule of the Assad family. Islamist-led rebels declared that they have taken Damascus after sweeping through other parts of the country. Syrian President Bashar al-Assad has fled the country. People in Hama and Damascus destroyed statues of the Assan family.,https://www.thehindu.com/videos/watch-assad-regime-falls-in-syria-after-rebels-enter-damascus/article68961318.ece,international
"Sonia Gandhi linked to organisation financed by George Soros Foundation, says BJP","Reiterating its allegation about a connection between the Congress party and billionaire George Soros, the BJP — through a thread on X — said it implied “their shared goal of diminishing India’s growth”",Devesh K. Pandey,"Sonia Gandhi linked to organisation financed by George Soros Foundation, says BJP Reiterating its allegation about a connection between the Congress party and billionaire George Soros, the BJP — through a thread on X — said it implied “their shared goal of diminishing India’s growth” The Bharatiya Janata Party (BJP) on Sunday (December 8, 2024) alleged that former Congress president Sonia Gandhi, as the co-president of the Forum of Democratic Leaders in the Asia-Pacific (FDL-AP), was linked to an organisation financed by the “George Soros Foundation.” Reiterating its allegation about a connection between the Congress party and billionaire George Soros, the BJP — through a thread on X — said it implied “their shared goal of diminishing India’s growth”.",https://www.thehindu.com/news/national/sonia-gandhi-linked-to-an-organisation-financed-by-george-soros-foundation-alleges-bjp/article68961260.ece,international
Burkina Faso junta appoints new Prime Minister,The junta in Burkina Faso seized power in September 2022 by ousting the military rule of Lt. Col. Paul Henri Sandaogo Damiba about eight months after it staged a coup,Miscellaneous,"Burkina Faso junta appoints new Prime Minister The junta in Burkina Faso seized power in September 2022 by ousting the military rule of Lt. Col. Paul Henri Sandaogo Damiba about eight months after it staged a coup Burkina Faso’s ruling military junta appointed a new Prime Minister, a day after dissolving the government without providing any reason. Rimtalba Jean Emmanuel Ouedraogo, until now Communications Minister and spokesperson of the government, will be the West African country's new Prime Minister, junta leader Ibrahim Traore said in a presidential decree read on state television Saturday.",https://www.thehindu.com/news/international/burkina-faso-junta-appoints-new-prime-minister/article68961675.ece,international
Syria war timeline: Assad's fall followed years of bloodshed and division,The first protests against Bashar Assad in 2011 quickly spread across Syria and were met by security forces with a wave of arrests and shootings,Miscellaneous,"Syria war timeline: Assad's fall followed years of bloodshed and division The first protests against Bashar Assad in 2011 quickly spread across Syria and were met by security forces with a wave of arrests and shootings The sudden collapse of Bashar al-Assad's rule over Syria marks the culmination of a nearly 14-year rebellion and a key moment in a civil war that killed hundreds of thousands of people, displaced half the population and drew in outside powers. Syria War live updates on December 8, 2024",https://www.thehindu.com/news/international/syria-war-timeline-assads-fall-followed-years-of-bloodshed-and-division/article68961420.ece,international
Foreign Secretary Misri to visit Dhaka tomorrow amid frosty India-Bangladesh ties,Mr. Misri is scheduled to hold wide-ranging talks with his Bangladeshi counterpart Md. Jashim Uddin and meet the country's de-facto foreign minister Mohammad Touhid Hossain,Miscellaneous,"Foreign Secretary Misri to visit Dhaka tomorrow amid frosty India-Bangladesh ties Mr. Misri is scheduled to hold wide-ranging talks with his Bangladeshi counterpart Md. Jashim Uddin and meet the country's de-facto foreign minister Mohammad Touhid Hossain Foreign Secretary Vikram Misri is expected to raise with Dhaka India's concerns over attacks on Hindus and other minorities as he embarks on a day-long visit to Bangladesh on Monday (December 9, 2024), in the first high-level trip from New Delhi after a massive uprising ended deposed Prime Minister Sheikh Hasina's 15-year rule in August. Mr. Misri is scheduled to hold wide-ranging talks with his Bangladeshi counterpart Md. Jashim Uddin and meet the country's de-facto foreign minister Mohammad Touhid Hossain.",https://www.thehindu.com/news/national/foreign-secretary-misri-to-visit-dhaka-tomorrow-amid-frosty-india-bangladesh-ties/article68961331.ece,international
South Korean prosecutors detain ex-Defence chief over martial law imposition,South Korean prosecutors have detained a former defence minister who allegedly recommended last week’s brief but stunning martial law imposition to President Yoon Suk Yeol,Miscellaneous,"South Korean prosecutors detain ex-Defence chief over martial law imposition South Korean prosecutors have detained a former defence minister who allegedly recommended last week’s brief but stunning martial law imposition to President Yoon Suk Yeol South Korean prosecutors on Sunday (December 8, 2024) detained a former Defence Minister who allegedly recommended last week’s brief but stunning martial law imposition to President Yoon Suk Yeol, making him the first figure detained over the case. Also Read | How will martial law flip-flop affect S. Korea?",https://www.thehindu.com/news/international/south-korea-ex-defence-minister-reportedly-arrested-as-president-hangs-on/article68961083.ece,international
"Abu Muhammad al-Jolani: Syria’s jihadist-in-chief
Premium",The man picked by Islamic State leader Abu Bakr al-Baghdadi to establish a branch in Syria is now leading the country’s most potent militant organisation that has made dramatic territorial advances in recent weeks,Stanly Johny,"Abu Muhammad al-Jolani: Syria’s jihadist-in-chief
Premium The man picked by Islamic State leader Abu Bakr al-Baghdadi to establish a branch in Syria is now leading the country’s most potent militant organisation that has made dramatic territorial advances in recent weeks “We deputised al-Jolani, who is one of our soldiers, with a group of our sons, and pushed them from Iraq to Syria to meet with our cells in Syria and set for them the plans and drew for them the policy of work,” Abu Bakr al-Baghdadi, the then-chief of the Islamic State of Iraq and Syria (ISIS) announced on April 2, 2014, referring to al-Qaeda’s Syria arm, Jabhat al-Nusra. Abu Muhammad al-Jolani, a Saudi-born Syrian jihadist was a lieutenant of Baghdadi. It was Jolani he turned to when he decided to expand his jihadist network into Syria, where a civil war broke out in 2011. “We supplied them with half of what is in the treasury every month, and supplied them with men who had battlefield experience from among the muhajirun [“emigrants”; foreign fighters] and ansar [“supporters”; local jihadists], so they did well next to their brothers from the ardent sons of Syria,” said Baghdadi, taking credit for the creation of a-Nusra. Baghdadi was killed in an American airstrike in Syria in October 2019. The ‘caliphate’ he built, which at its peak had spread from eastern Syria’s Deir Ezzor to Iraq’s Mosul, was destroyed. The Islamic State, the jihadist organisation Baghdadi created and led, has been scattered and weakened ever since. But Jolani, the man Baghdadi chose to lead his network in Syria, is today the leader of Syria’s armed insurgency. He is the ‘emir’ of the ‘Syrian Salvation Government’, which is based in the northwestern province of Idlib, and the leader of Hayat Tahrir al-Sham (HTS), the main opposition jihadist group. In the last week of November, when the whole region’s focus was on a ceasefire deal between Israel and Hezbollah, Jolani’s jihadists launched a surprise attack on Syrian forces from Idlib. Before most people understood what was actually happening, the HTS captured Aleppo, Syria’s second-largest city.",https://www.thehindu.com/news/international/abu-muhammad-al-jolani-syrias-jihadist-in-chief/article68959633.ece,international
Imran Khan accuses Pak government of 'authoritarianism' as cases against him reach 188,"The former Prime Minister is booked in 99 cases in Punjab, 76 in Islamabad and two in Khyber Pakhtunkhwa.",Miscellaneous,"Imran Khan accuses Pak government of 'authoritarianism' as cases against him reach 188 The former Prime Minister is booked in 99 cases in Punjab, 76 in Islamabad and two in Khyber Pakhtunkhwa. Former Prime Minister Imran Khan accused the government of 'authoritarianism' as the number of cases and inquiries against him reached 188. The data of cases was presented by the Ministry of Interior to the Islamabad High Court (IHC) on Friday on order in a petition filed by Mr. Khan’s sister, Noreen Niazi, who sought the details of cases against her brother, Dawn reported.",https://www.thehindu.com/news/international/imran-khan-accuses-pak-government-of-authoritarianism-as-cases-against-him-reach-188/article68959429.ece,international
Iron-fisted Assad under threat as Syrian rebels draw closer,Assad has not delivered any public remarks since insurgents took Aleppo a week ago but said in a call with Iran’s president that the escalation sought to redraw the region for Western interests,Miscellaneous,"Iron-fisted Assad under threat as Syrian rebels draw closer Assad has not delivered any public remarks since insurgents took Aleppo a week ago but said in a call with Iran’s president that the escalation sought to redraw the region for Western interests President Bashar al-Assad used Russian and Iranian firepower to beat back rebel forces during years of civil war but never defeated them, leaving him vulnerable when his allies were distracted by wars elsewhere and his enemies went on the march. The rebels' lightning advance through western Syria marks one of the most serious threats to half a century of Assad family rule in Damascus, and a seismic moment for the Middle East.",https://www.thehindu.com/news/international/iron-fisted-assad-under-threat-as-syrian-rebels-draw-closer/article68959471.ece,international
Reaction to Syrian rebels’ widening advance against President Bashar al-Assad,"Reactions from world leaders as Syrian rebels entered suburbs of the city of Homs, pressing a lightning week-long advance.",Miscellaneous,"Reaction to Syrian rebels’ widening advance against President Bashar al-Assad Reactions from world leaders as Syrian rebels entered suburbs of the city of Homs, pressing a lightning week-long advance. Syrian rebels entered suburbs of the city of Homs on Saturday (December 7, 2024), sources said, pressing a lightning week-long advance as front lines collapse across the country and government forces battle to save President Bashar al-Assad's 24-year rule. Syria civil war LIVE updates",https://www.thehindu.com/news/international/reactions-from-world-leaders-to-syria-civil-unrest-on-december-7-2024/article68959836.ece,international
"How will martial law flip-flop affect S. Korea? 
Premium","What led to the declaration, and the subsequent swift withdrawal, of emergency provisions? What are the key reasons for the development? How many times has martial law been imposed in the country? What happened to the impeachment motion against President Yoon Suk Yeol?",Adithya Narayan,"How will martial law flip-flop affect S. Korea? 
Premium What led to the declaration, and the subsequent swift withdrawal, of emergency provisions? What are the key reasons for the development? How many times has martial law been imposed in the country? What happened to the impeachment motion against President Yoon Suk Yeol? The story so far: For a brief while on December 3, South Korea, a country with a history of military rule, had fleeting visions of its past, as President Yoon Suk Yeol imposed emergency martial law. This would have curbed the activities of political parties, brought the media under the ambit of law, and required protesting workers to resume duties.",https://www.thehindu.com/news/international/how-will-martial-law-flip-flop-affect-south-korea/article68960010.ece,international
Ukraine confirms second Danish delivery of F-16s as Zelenskyy seeks support in Paris,President Volodymyr Zelenskyy says Denmark has delivered a second batch of F-16 fighter jets to Ukraine,Miscellaneous,"Ukraine confirms second Danish delivery of F-16s as Zelenskyy seeks support in Paris President Volodymyr Zelenskyy says Denmark has delivered a second batch of F-16 fighter jets to Ukraine Denmark has delivered a second batch of F-16 fighter jets to Ukraine, President Volodymyr Zelenskyy said Saturday as he traveled to Paris to meet with top politicians and dignitaries. In a message on Telegram, Zelenskyy praised Denmark and lamented a lack of dedication from other allies.",https://www.thehindu.com/news/international/ukraine-confirms-second-danish-delivery-of-f-16s-as-zelenskyy-seeks-support-in-paris/article68959738.ece,international
Indian-Americans plan protests against attacks on Hindus in Bangladesh,The minority Hindu community in Muslim-majority Bangladesh has reportedly faced more than 200 attacks in 50-odd districts following the ouster of the Sheikh Hasina government on August 5,Miscellaneous,"Indian-Americans plan protests against attacks on Hindus in Bangladesh The minority Hindu community in Muslim-majority Bangladesh has reportedly faced more than 200 attacks in 50-odd districts following the ouster of the Sheikh Hasina government on August 5 Several Indian-Americans plan to hold peaceful rallies in the U.S. capital and Chicago over the next two days to protest the attacks against Hindus in Bangladesh, organisers have said. The march protesting the 'Genocide of Hindus in Bangladesh' is being organised by HinduAction near the White House on Monday, December 9, while the 'Stop the Genocide: Save Hindu Lives in Bangladesh' is being organised by eminent community leaders in Chicago on Sunday, December 8.",https://www.thehindu.com/news/international/indian-americans-plan-protests-against-attacks-on-hindus-in-bangladesh/article68959733.ece,international
"Why can’t the world agree on a plastic ban? 
Premium",How much plastic waste is produced now? What is the most common type of plastic waste found in the environment? Why are several countries averse to tackling plastic pollution? Why did talks fail at Busan? Is another round of negotiations likely?,Jacob Koshy,"Why can’t the world agree on a plastic ban? 
Premium How much plastic waste is produced now? What is the most common type of plastic waste found in the environment? Why are several countries averse to tackling plastic pollution? Why did talks fail at Busan? Is another round of negotiations likely? The story so far:The 5th Intergovernmental Negotiating Committee (INC-5) on plastic pollution was a conclave of delegations from about 170 countries mandated to establish a legally binding treaty to end plastic pollution, informally called the Global Plastics Treaty. Despite a week of meetings, the INC-5 failed to meet its mandate. The United Nations Environment Assembly (UNEA) resolved in March 2022 to ‘end plastic pollution, including in the marine environment.’ To that end, INC committees were constituted and tasked with negotiating a treaty before the end of 2024. Over the last two years, countries met five times, and attempted to bridge divergent views on how to end plastic pollution. Several countries are enthusiastic about ways and means to encourage recycling and prohibit certain plastics that lead to littering — India for instance has banned single-use plastic since 2022 — but many of them are reluctant to limit plastic production. Several countries are either petro-states or those that have significant industries that manufacture plastic polymers. Before the latest, and what was expected to be the last round of negotiations, began in Busan, South Korea, the Chair of the INC-5, Luis Vayas Valdivieso, circulated a draft text called a ‘non paper.’ This was roughly a synthesis of the views of all countries on managing plastic production but in the end, it turned out that despite long negotiations, the chasm between countries who viewed addressing plastic pollution as a waste management problem, and those that saw it as unachievable without cutting its production at source, was one that was too wide to bridge.",https://www.thehindu.com/sci-tech/energy-and-environment/why-cant-the-world-agree-on-a-plastic-ban/article68959805.ece,international
South Korean President Yoon avoids an impeachment attempt over martial law,The defeat of the motion is expected to intensify public protests calling for President Yoon’s ouster and deepen political chaos in South Korea,Miscellaneous,"South Korean President Yoon avoids an impeachment attempt over martial law The defeat of the motion is expected to intensify public protests calling for President Yoon’s ouster and deepen political chaos in South Korea South Korea’s embattled President Yoon Suk Yeol avoided an opposition-led attempt to impeach him over his short-lived imposition of martial law , as most ruling party lawmakers boycotted a parliamentary vote Saturday (December 7, 2024) to deny a two-thirds majority needed to suspend his presidential power. The scrapping of the motion is expected to intensify public protests calling for Mr. Yoon’s ouster and deepen political chaos in South Korea, with a survey suggesting a majority of South Koreans support the president’s impeachment. Yoon’s martial law declaration drew criticism from his own ruling conservative People Power Party, but it is also determined to oppose Yoon’s impeachment apparently because it fears losing the presidency to liberals.",https://www.thehindu.com/news/international/south-korea-yoon-suk-yeol-impeachment-vote-updates-december-7-2024/article68958603.ece,international
Notre Dame reopens five years after fire,"The reconstruction effort has cost around 700 million euros ($750 million), financed from donations, with the re-opening achieved within a five-year deadline set by Macron despite predictions it could take decades",Miscellaneous,"Notre Dame reopens five years after fire The reconstruction effort has cost around 700 million euros ($750 million), financed from donations, with the re-opening achieved within a five-year deadline set by Macron despite predictions it could take decades The archbishop of Paris re-opened Notre Dame cathedral on Saturday (December 7, 2024) by symbolically knocking on the doors and entering the 12th-century landmark which has been restored after a devastating fire in 2019. Wearing new designer vestments and carrying a staff cut from one of the roof beams that survived the inferno, Laurent Ulrich joined hundreds of VIPs inside the Gothic masterpiece for a two-hour ceremony.",https://www.thehindu.com/news/international/notre-dame-re-opens-five-years-after-fire/article68959971.ece,international
"Syria war highlights: With Assad ousted, Middle East battle lines are redrawn","Biden says Assad government’s fall in Syria is a ‘fundamental act of justice’, but a ‘moment of risk and uncertainty’",The Hindu Bureau,"Syria war highlights: With Assad ousted, Middle East battle lines are redrawn Biden says Assad government’s fall in Syria is a ‘fundamental act of justice’, but a ‘moment of risk and uncertainty’ ",https://www.thehindu.com/news/international/syria-civil-war-live-updates/article68959496.ece,international
